<?xml version="1.0" encoding="UTF-8"?>
<!--
==============================================================================
 This software is part of the Open Standard for Unattended Sensors (OSUS)
 reference implementation (OSUS-R).

 To the extent possible under law, the author(s) have dedicated all copyright
 and related and neighboring rights to this software to the public domain
 worldwide. This software is distributed without any warranty.

 You should have received a copy of the CC0 Public Domain Dedication along
 with this software. If not, see
 <http://creativecommons.org/publicdomain/zero/1.0/>.
==============================================================================
-->
<p:Configurations xmlns:p="config.model.th.dod.mil" xmlns:xsi="http://www.w3.org/2001/XMLSchema-instance" xsi:schemaLocation="config.model.th.dod.mil schemas/model/config/Configurations.xsd ">

  <!-- ttyS0 is serial console, already in use by getty process, intentionally left out -->

  <factoryObjects name="/dev/ttyS1">
    <factoryType>PhysicalLink</factoryType>
    <physicalLinkType>SerialPort</physicalLinkType>
    <createPolicy>IfMissing</createPolicy>
  </factoryObjects>

  <!-- Depends on what USB serial device is attached, may not actually exist. -->
  <factoryObjects name="/dev/ttyUSB0">
    <factoryType>PhysicalLink</factoryType>
    <physicalLinkType>SerialPort</physicalLinkType>
    <createPolicy>IfMissing</createPolicy>
  </factoryObjects>

  <!-- Depends on what USB serial device is attached, may not actually exist. -->
  <factoryObjects name="/dev/ttyUSB1">
    <factoryType>PhysicalLink</factoryType>
    <physicalLinkType>SerialPort</physicalLinkType>
    <createPolicy>IfMissing</createPolicy>
  </factoryObjects>

  <!-- This configuration can be used to prevent the system from entering the power management sleep mode when a remote socket
       channel is active or connected. This applies to both incoming and outgoing socket channels. -->
  <!-- 
  <osgiConfigs>
    <pid>mil.dod.th.ose.remote.api.RemoteSettings</pid>
    <properties key="preventSleepMode" value="true"/>
  </osgiConfigs>
  -->

  <!-- This configuration automatically suppresses Configuration Admin debug logging that can get intertwined with OSUS-R
       shell command output. -->
  <osgiConfigs>
    <factoryPid>mil.dod.th.ose.logging.LogFilterImpl</factoryPid>
    <properties key="severity" value="Warning"/>
    <properties key="bundleSymbolicFilter" value="org.apache.felix.configadmin"/>
  </osgiConfigs>
</p:Configurations>
